Sheet: Sheet1
A1: A | B1: B | C1: C
A2: 1 | B2: =RAND() -> 0.32730312947908891 | C2: =RC[-2]^(2*RC[-1]) -> 1
A3: 2 | B3: =RAND() -> 0.17722726500376307 | C3: =RC[-2]^(2*RC[-1]) -> 1.2785020997619414
A4: 3 | B4: =RAND() -> 0.71940562358527982 | C4: =RC[-2]^(2*RC[-1]) -> 4.8583346628019513
A5: 4 | B5: =RAND() -> 0.63110099897141791 | C5: =RC[-2]^(2*RC[-1]) -> 5.7533570103925387
A6: 5 | B6: =RAND() -> 0.18591184801433036 | C6: =RC[-2]^(2*RC[-1]) -> 1.8192551391790046
A7: 6 | B7: =RAND() -> 0.66705586132025252 | C7: =RC[-2]^(2*RC[-1]) -> 10.917940046038883
A8: 7 | B8: =RAND() -> 0.73226485646616601 | C8: =RC[-2]^(2*RC[-1]) -> 17.285071881801127